{
  "schemaVersion": "threat-control-catalog.v1",
  "policyVersion": "application-threat-model.v1",
  "catalogId": "synthetic:threat-control-catalog:foundation",
  "dataMode": "synthetic",
  "generatedAt": "2028-01-15T12:00:00Z",
  "assumptions": [
    "PostgreSQL application records remain canonical.",
    "Every high-risk runtime feature remains false by default.",
    "This fixture is policy evidence and not a production assurance claim."
  ],
  "hardRules": {
    "coreBuildRequiresVerus": false,
    "mainnetWritesAllowed": false,
    "privateMaterialAllowedInPublicProvenance": false,
    "aiMayExerciseHumanIntent": false,
    "automaticAllegationPublicationAllowed": false,
    "provenanceProvesTruth": false,
    "highRiskFeaturesDefaultEnabled": false,
    "optionalDependencyFailureBlocksSafePublicReads": false,
    "productionAssuranceClaimed": false
  },
  "actorClasses": [
    "external_attacker",
    "compromised_user",
    "representative_or_staff",
    "coordinated_group",
    "malicious_submitter",
    "colluding_moderators",
    "insider",
    "data_broker",
    "scraper",
    "source_publisher",
    "compromised_dependency",
    "ai_provider",
    "wallet_link_attacker",
    "compromised_signer_or_node",
    "operator_error"
  ],
  "boundaryIds": [
    "B01",
    "B02",
    "B03",
    "B04",
    "B05",
    "B06",
    "B07",
    "B08",
    "B09",
    "B10",
    "B11",
    "B12"
  ],
  "domainCoverage": [
    "authentication_authority",
    "privacy_location",
    "no_social_credit",
    "sources_documents",
    "ai",
    "moderation_safety",
    "mobile_supply_chain",
    "mobile_links_storage_push",
    "verus_account_proof",
    "verus_identity_update",
    "verus_managed_identities",
    "provenance",
    "operations_resilience",
    "public_registry_memory"
  ],
  "threats": [
    {
      "threatId": "AUTH-01",
      "domain": "authentication_authority",
      "title": "Account takeover and authority escalation",
      "scenario": "A synthetic attacker replays a session or obtains a role outside its scope.",
      "assetClasses": ["accounts_sessions", "representative_authority"],
      "actorClasses": ["external_attacker", "compromised_user", "representative_or_staff"],
      "boundaryIds": ["B01", "B02", "B03", "B07"],
      "impacts": ["authorization", "privacy", "integrity"],
      "controls": [
        {
          "controlId": "auth_deny_by_default",
          "status": "implemented_foundation",
          "description": "Route and domain policy deny invalid sessions, roles, scopes, and replay.",
          "evidenceReferences": ["packages/auth/src/authentication.abuse.test.ts"]
        }
      ],
      "tests": [
        {
          "testId": "auth_abuse",
          "kind": "automated",
          "status": "implemented",
          "evidenceReference": "packages/auth/src/authentication.abuse.test.ts",
          "redactionRequired": true
        }
      ],
      "residualRisk": {
        "severity": "high",
        "status": "pilot_blocker",
        "explanation": "Production providers and representative authority workflows are not approved."
      },
      "incidentOwnerRole": "security_lead",
      "safeDegradation": "Deny account and authority commands while preserving anonymous public reads.",
      "pilotBlocker": true,
      "unresolvedDecisions": ["production_auth_provider"]
    },
    {
      "threatId": "PRIV-01",
      "domain": "privacy_location",
      "title": "Precise location or private civic activity leakage",
      "scenario": "Restricted synthetic data reaches logs, analytics, public output, or another account.",
      "assetClasses": ["location", "private_civic_activity"],
      "actorClasses": ["insider", "data_broker", "scraper"],
      "boundaryIds": ["B03", "B12"],
      "impacts": ["privacy", "safety"],
      "controls": [
        {
          "controlId": "classified_domain_separation",
          "status": "implemented_foundation",
          "description": "Transient location and separate security domains reject public serialization and forbidden storage.",
          "evidenceReferences": [
            "tests/tooling/security-domain-foundation.test.ts",
            "packages/domain/src/location-resolution.test.ts"
          ]
        }
      ],
      "tests": [
        {
          "testId": "location_redaction",
          "kind": "automated",
          "status": "implemented",
          "evidenceReference": "tests/tooling/location-resolution-foundation.test.ts",
          "redactionRequired": true
        }
      ],
      "residualRisk": {
        "severity": "critical",
        "status": "requires_mitigation",
        "explanation": "Production telemetry, providers, and participation stores require review."
      },
      "incidentOwnerRole": "privacy_lead",
      "safeDegradation": "Disable location/private writes and retain safe public directory reads.",
      "pilotBlocker": true,
      "unresolvedDecisions": ["production_telemetry_boundary"]
    },
    {
      "threatId": "NSC-01",
      "domain": "no_social_credit",
      "title": "Generalized citizen reputation or political profile",
      "scenario": "Narrow identity, moderation, location, or participation states are combined into a portable citizen value.",
      "assetClasses": ["identity_attestation", "private_civic_activity", "analytics_exports"],
      "actorClasses": ["insider", "data_broker", "ai_provider"],
      "boundaryIds": ["B03", "B08", "B12"],
      "impacts": ["privacy", "authorization", "democratic_process"],
      "controls": [
        {
          "controlId": "no_social_credit_invariant",
          "status": "implemented_foundation",
          "description": "Forbidden joins, names, exports, and agent outputs are rejected by foundation tests.",
          "evidenceReferences": ["packages/auth/src/no-social-credit.test.ts"]
        }
      ],
      "tests": [
        {
          "testId": "no_social_credit_foundation",
          "kind": "automated",
          "status": "implemented",
          "evidenceReference": "packages/auth/src/no-social-credit.test.ts",
          "redactionRequired": true
        }
      ],
      "residualRisk": {
        "severity": "critical",
        "status": "pilot_blocker",
        "explanation": "Future analytics, AI, and cross-product paths need issue #57 enforcement and review."
      },
      "incidentOwnerRole": "privacy_lead",
      "safeDegradation": "Reject the query, export, model, or integration and preserve narrow purpose-limited states only.",
      "pilotBlocker": true,
      "unresolvedDecisions": ["no_social_credit_independent_review"]
    },
    {
      "threatId": "SRC-01",
      "domain": "sources_documents",
      "title": "Source poisoning, SSRF, or hostile content",
      "scenario": "A malicious source or submitter targets internal networks, parsers, rights, or public record integrity.",
      "assetClasses": ["source_records", "evidence_moderation"],
      "actorClasses": ["malicious_submitter", "source_publisher", "compromised_dependency"],
      "boundaryIds": ["B05", "B06"],
      "impacts": ["integrity", "availability", "legal", "supply_chain"],
      "controls": [
        {
          "controlId": "source_quarantine",
          "status": "implemented_foundation",
          "description": "Synthetic connector retrieval revalidates origins and addresses, applies limits, and quarantines candidates.",
          "evidenceReferences": ["packages/connectors/src/source-ingestion.test.ts"]
        }
      ],
      "tests": [
        {
          "testId": "source_ssrf",
          "kind": "automated",
          "status": "implemented",
          "evidenceReference": "packages/connectors/src/source-ingestion.test.ts",
          "redactionRequired": true
        }
      ],
      "residualRisk": {
        "severity": "critical",
        "status": "pilot_blocker",
        "explanation": "Production egress sandbox, publishers, licences, and arbitrary-document controls are absent."
      },
      "incidentOwnerRole": "data_stewardship",
      "safeDegradation": "Disable retrieval and publication; mark source state unavailable or quarantined.",
      "pilotBlocker": true,
      "unresolvedDecisions": ["production_source_inventory", "hostile_document_stack"]
    },
    {
      "threatId": "AI-01",
      "domain": "ai",
      "title": "AI fabrication, prompt injection, or private-data exfiltration",
      "scenario": "An AI provider or hostile source causes fabricated civic output, tool escape, or restricted-data disclosure.",
      "assetClasses": ["ai_inputs_jobs", "source_records", "private_civic_activity"],
      "actorClasses": ["ai_provider", "malicious_submitter", "source_publisher"],
      "boundaryIds": ["B06", "B08"],
      "impacts": ["privacy", "integrity", "democratic_process"],
      "controls": [
        {
          "controlId": "ai_draft_only",
          "status": "accepted_policy",
          "description": "AI has no human intent or publication authority and receives no private civic data.",
          "evidenceReferences": ["docs/METHODOLOGY.md", "docs/MODERATION_AND_DUE_PROCESS.md"]
        }
      ],
      "tests": [
        {
          "testId": "ai_red_team",
          "kind": "independent_review",
          "status": "planned",
          "evidenceReference": null,
          "redactionRequired": true
        }
      ],
      "residualRisk": {
        "severity": "critical",
        "status": "pilot_blocker",
        "explanation": "No provider, isolation gateway, or adversarial evaluation is approved."
      },
      "incidentOwnerRole": "ai_governance_owner",
      "safeDegradation": "Disable AI and use a manual queue or unavailable state.",
      "pilotBlocker": true,
      "unresolvedDecisions": ["ai_provider_and_model"]
    },
    {
      "threatId": "MOD-01",
      "domain": "moderation_safety",
      "title": "Moderation capture, doxxing, or false publication",